{"$schema":"https://json-schema.org/draft/2020-12/schema","additionalProperties":false,"description":"v1.2: corpus_id admite prefijos G05 (G0.5 congelado) y G1D (corpus territorial preregistrado D3). Los corpus v1 siguen siendo validos.","properties":{"as_of":{"$ref":"common/temporal.schema.json#/$defs/iso_date"},"corpus_id":{"type":"string"},"entities":{"items":{"additionalProperties":false,"properties":{"corpus_id":{"pattern":"^(G05|G1D)-[0-9]{3}$","type":"string"},"inclusion_reason":{"type":"string"},"legal_name":{"type":"string"},"source_records":{"items":{"additionalProperties":false,"properties":{"record_key":{"type":"object"},"snapshot_file":{"type":"string"},"source":{"type":"string"}},"required":["source","snapshot_file","record_key"],"type":"object"},"type":"array"}},"required":["corpus_id","legal_name","source_records","inclusion_reason"],"type":"object"},"type":"array"},"entity_count":{"minimum":1,"type":"integer"},"selection_rule":{"type":"string"}},"required":["corpus_id","as_of","entity_count","selection_rule","entities"],"title":"FinReg-ES frozen entity corpus v1.2","type":"object"}
