{
 "corpus_id": "corpus-g1-e-001",
 "as_of": "2026-09-14",
 "entity_count": 10,
 "selection_rule": "Corpus adversarial G1-E preregistrado (E3, extracto -003): 10 entidades reales con evidencia negativa heterogenea",
 "entities": [
  {
   "corpus_id": "E3-001",
   "legal_name": "DENIZEN GLOBAL FINANCIAL, S.A.",
   "source_records": [
    {
     "source": "EBA_PSD2_REGISTER",
     "snapshot_file": "raw/h4-eba-psd2-20260913.zip",
     "record_key": {
      "EntityCode": "ES_BE!6822",
      "EntityType": "PSD_PI",
      "EntityVersion": "20260526191343957"
     }
    },
    {
     "source": "BDE_REGISTRO_SERVICIOS_PAGO",
     "snapshot_file": "raw/bde-registro-servicios-pago.xlsx",
     "record_key": {
      "field": "CÓDIGO BE",
      "value": "6822"
     }
    }
   ],
   "inclusion_reason": "E3-01: retirada dual-source el mismo dia (BdE renuncia 23/07/2020 + EBA ENT_AUT par); raiz unica"
  },
  {
   "corpus_id": "E3-002",
   "legal_name": "MMG Corporation s.r.o.",
   "source_records": [
    {
     "source": "EBA_PSD2_REGISTER",
     "snapshot_file": "raw/h4-eba-psd2-20260913.zip",
     "record_key": {
      "EntityCode": "CZ_CNB!29142024",
      "EntityType": "PSD_PI",
      "EntityVersion": "20260820190047319"
     }
    }
   ],
   "inclusion_reason": "E3-02: ENT_AUT len=3 (retirada + reautorizacion); probes bitemporales raiz vs ruta territorial"
  },
  {
   "corpus_id": "E3-003",
   "legal_name": "BANKINTER CONSUMER FINANCE, E.F.C., S.A.",
   "source_records": [
    {
     "source": "EBA_PSD2_REGISTER",
     "snapshot_file": "raw/h4-eba-psd2-20260913.zip",
     "record_key": {
      "EntityCode": "ES_BE!8832",
      "EntityType": "PSD_PI",
      "EntityVersion": "20260710191146901"
     }
    },
    {
     "source": "BDE_REGISTRO_SERVICIOS_PAGO",
     "snapshot_file": "raw/bde-registro-servicios-pago.xlsx",
     "record_key": {
      "field": "CÓDIGO BE",
      "value": "8832"
     }
    }
   ],
   "inclusion_reason": "E3-03: baja BdE por transformacion 22/02/2019 distinta de la retirada EBA 01/07/2026"
  },
  {
   "corpus_id": "E3-004",
   "legal_name": "CERRO CATEDRAL ENTIDAD DE PAGO, S.A.",
   "source_records": [
    {
     "source": "BDE_REGISTRO_SERVICIOS_PAGO",
     "snapshot_file": "raw/bde-registro-servicios-pago.xlsx",
     "record_key": {
      "field": "CÓDIGO BE",
      "value": "6844"
     }
    }
   ],
   "inclusion_reason": "E3-04: EP domestica en alta con ACTIVIDADES={6} — ENUMERATED_ABSENCE atomica + positivo en la misma via"
  },
  {
   "corpus_id": "E3-005",
   "legal_name": "Mollie B.V.",
   "source_records": [
    {
     "source": "EBA_PSD2_REGISTER",
     "snapshot_file": "raw/h4-eba-psd2-20260913.zip",
     "record_key": {
      "EntityCode": "NL_DNB!F0038",
      "EntityType": "PSD_PI",
      "EntityVersion": "20251030222249713"
     }
    },
    {
     "source": "EBA_PSD2_REGISTER",
     "snapshot_file": "raw/h4-eba-psd2-20260913.zip",
     "record_key": {
      "EntityCode": "NL_DNB!F0038",
      "EntityType": "PSD_EMI",
      "EntityVersion": "20251030222249713"
     }
    }
   ],
   "inclusion_reason": "E3-05: PI retirada 03/02/2025 + EMI autorizada el mismo dia — root withdrawal no es entity-global"
  },
  {
   "corpus_id": "E3-006",
   "legal_name": "FINTONIC (6892 -> 6935)",
   "source_records": [
    {
     "source": "EBA_PSD2_REGISTER",
     "snapshot_file": "raw/h4-eba-psd2-20260913.zip",
     "record_key": {
      "EntityCode": "ES_BE!6892",
      "EntityType": "PSD_PI",
      "EntityVersion": "20260526191343957"
     }
    },
    {
     "source": "EBA_PSD2_REGISTER",
     "snapshot_file": "raw/h4-eba-psd2-20260913.zip",
     "record_key": {
      "EntityCode": "ES_BE!6935",
      "EntityType": "PSD_AISP",
      "EntityVersion": "20260526191343957"
     }
    },
    {
     "source": "BDE_REGISTRO_SERVICIOS_PAGO",
     "snapshot_file": "raw/bde-registro-servicios-pago.xlsx",
     "record_key": {
      "field": "CÓDIGO BE",
      "value": "6935"
     }
    }
   ],
   "inclusion_reason": "E3-06: PI 6892 escindida 29/01/2024 -> sucesora 6935 (BdE baja transformacion 26/11/2024 + EBA AISP 03/12/2024); continuidad PIS no demostrada"
  },
  {
   "corpus_id": "E3-007",
   "legal_name": "SIBS Pagamentos",
   "source_records": [
    {
     "source": "EBA_PSD2_REGISTER",
     "snapshot_file": "raw/h4-eba-psd2-20260913.zip",
     "record_key": {
      "EntityCode": "PSD_PI!PT_BP!8703",
      "EntityType": "PSD_PI",
      "EntityVersion": "20260423113407953"
     }
    }
   ],
   "inclusion_reason": "E3-07: LPS PI ausente de los workbooks BdE — ausencia no interpretable como negativo BdE"
  },
  {
   "corpus_id": "E3-008",
   "legal_name": "Wise Europe SA",
   "source_records": [
    {
     "source": "EBA_PSD2_REGISTER",
     "snapshot_file": "raw/h4-eba-psd2-20260913.zip",
     "record_key": {
      "EntityCode": "BE_NBB!0713629988",
      "EntityType": "PSD_PI",
      "EntityVersion": "20251030193213813"
     }
    },
    {
     "source": "EBA_PSD2_REGISTER",
     "snapshot_file": "raw/h4-eba-psd2-20260913.zip",
     "record_key": {
      "EntityCode": "BE_NBB!0713629988!ES",
      "EntityType": "PSD_BR",
      "EntityVersion": "20260205200842226"
     }
    },
    {
     "source": "BDE_REGISTRO_CON_ESTABLECIMIENTO",
     "snapshot_file": "raw/bde-registro-con-establecimiento.xlsx",
     "record_key": {
      "field": "CÓDIGO BE",
      "value": "6946"
     }
    }
   ],
   "inclusion_reason": "E3-08: PIS ausente en los tres vectores (parent FPS, PSD_BR, sucursal BdE 6946) — todas las vias cerradas"
  },
  {
   "corpus_id": "E3-009",
   "legal_name": "Eupago - Instituicao de Pagamento Lda",
   "source_records": [
    {
     "source": "EBA_PSD2_REGISTER",
     "snapshot_file": "raw/h4-eba-psd2-20260913.zip",
     "record_key": {
      "EntityCode": "PSD_PI!PT_BP!8709",
      "EntityType": "PSD_PI",
      "EntityVersion": "20251030231925863"
     }
    },
    {
     "source": "EBA_PSD2_REGISTER",
     "snapshot_file": "raw/h4-eba-psd2-20260913.zip",
     "record_key": {
      "EntityCode": "PSD_PI!PT_BP!8709",
      "EntityType": "PSD_BR",
      "EntityVersion": "20260909084530565"
     }
    },
    {
     "source": "BDE_REGISTRO_CON_ESTABLECIMIENTO",
     "snapshot_file": "raw/bde-registro-con-establecimiento.xlsx",
     "record_key": {
      "field": "CÓDIGO BE",
      "value": "6938"
     }
    }
   ],
   "inclusion_reason": "E3-09: PIS ausente en Services{ES} del parent (FPS) pero presente en PSD_BR + BdE 6938 (BRANCH) — contraste E3-008"
  },
  {
   "corpus_id": "E3-010",
   "legal_name": "THUNES FINANCIAL SERVICES",
   "source_records": [
    {
     "source": "EBA_PSD2_REGISTER",
     "snapshot_file": "raw/h4-eba-psd2-20260913.zip",
     "record_key": {
      "EntityCode": "FR_ACPR!384558",
      "EntityType": "PSD_PI",
      "EntityVersion": "20260831191438388"
     }
    }
   ],
   "inclusion_reason": "E3-01b: retirada 27/08/2026 con Services{ES} aun declarados — codigos tras retirada no son entitlement"
  }
 ]
}
